{
  "schema_version": "1.0",
  "state_revision": 18,
  "project_id": "crypto_funding_basis",
  "repository": "williammolina489/crypto-funding-basis-bot",
  "branch": "research/e002-xbtusd-feasibility",
  "head_sha": "fbf80c39b6df741b9d8037fd28cbd96a7632b336",
  "lifecycle_status": "NEEDS_HUMAN",
  "experiment": {
    "id": "E002",
    "stage": "Finite feasibility sequence ended without valid checkpoint evidence",
    "status": "STOPPED"
  },
  "governance": {
    "methodology_frozen": true,
    "performance_viewed": false,
    "validation_state": "NOT_APPLICABLE",
    "oos_state": "NOT_APPLICABLE",
    "data_integrity_status": "UNKNOWN"
  },
  "current_blockers": [
    "Checkpoint A was launched by GitHub Actions after the frozen 2026-09-23 10:00–12:00 America/New_York authorization window had already closed, so the validator failed before any production network request.",
    "The preregistered technical retry was allowed only inside the same frozen checkpoint window. That window has expired, so no E002 retry remains authorized.",
    "Because Checkpoint A never produced valid E002 evidence, Checkpoints B and C correctly did not advance the experiment."
  ],
  "next_permitted_actions": [],
  "forbidden_actions": [
    "Do not rerun or modify E001.",
    "Do not collect E002 live production evidence before explicit RUNNING authorization.",
    "Do not change E002 frozen instruments, checkpoint windows, PASS/BLOCKED rules, evidence-isolation rules, or retry rules after preregistration without a new explicit amendment/experiment decision.",
    "Do not calculate basis attractiveness, funding carry, opportunity frequency, break-even economics, or P&L during E002.",
    "Do not substitute BTCUSD, another Bitnomial spot product, Coinbase, another venue, an index, midpoint/reference price, synthetic spot, another perpetual, or another asset inside E002.",
    "Do not build or activate a prospective performance collector under E002.",
    "Do not use authenticated exchange access or place orders.",
    "Do not use real money."
  ],
  "human_action_required": true,
  "human_action_reason": "E002 ended INCONCLUSIVE / STOPPED because the scheduled runner missed the frozen Checkpoint A window before any live evidence request. The same-window retry exception has expired. Any new feasibility attempt requires a new explicit human experiment/preregistration decision; E002 itself must not be rescheduled or amended retroactively.",
  "updated_at": "2026-10-01T21:07:30Z",
  "source_documents": [
    "williammolina489/crypto-funding-basis-bot@research/e001-prospective-collector:PROJECT_STATE.md",
    "williammolina489/crypto-funding-basis-bot@research/e001-prospective-collector:EXPERIMENTS.md",
    "williammolina489/crypto-funding-basis-bot@research/e001-prospective-collector:ROADMAP.md",
    "williammolina489/crypto-funding-basis-bot#2",
    "https://github.com/williammolina489/crypto-funding-basis-bot/actions/runs/35517004197",
    "https://github.com/williammolina489/crypto-funding-basis-bot/actions/runs/35521017801",
    "https://github.com/williammolina489/crypto-funding-basis-bot/actions/runs/35528302590",
    "https://github.com/williammolina489/crypto-funding-basis-bot/actions/runs/35536729794",
    "https://github.com/williammolina489/crypto-funding-basis-bot/actions/runs/35544098730",
    "williammolina489/crypto-funding-basis-bot@87a40b91052e3c6f0800f55fe3987f27b27a795b",
    "https://github.com/williammolina489/crypto-funding-basis-bot/actions/runs/35546762534",
    "https://github.com/williammolina489/crypto-funding-basis-bot/actions/runs/35610149714",
    "williammolina489/crypto-funding-basis-bot@2397b2568148ac0b6df8017a9ed041fe30728fce:PROJECT_STATE.md",
    "williammolina489/crypto-funding-basis-bot@2397b2568148ac0b6df8017a9ed041fe30728fce:EXPERIMENTS.md",
    "williammolina489/crypto-funding-basis-bot@2397b2568148ac0b6df8017a9ed041fe30728fce:ROADMAP.md",
    "https://github.com/williammolina489/crypto-funding-basis-bot/actions/runs/35622987498",
    "williammolina489/crypto-funding-basis-bot@research/e002-xbtusd-feasibility:PROJECT_STATE.md",
    "williammolina489/crypto-funding-basis-bot@research/e002-xbtusd-feasibility:EXPERIMENTS.md",
    "williammolina489/crypto-funding-basis-bot@research/e002-xbtusd-feasibility:ROADMAP.md",
    "williammolina489/crypto-funding-basis-bot@research/e002-xbtusd-feasibility:DATA_SOURCES.md",
    "williammolina489/crypto-funding-basis-bot#3",
    "williammolina489/crypto-funding-basis-bot@fe04660c9c64ab96872fa56a55854aaa749e08c0:research/E002_XBTUSD_FEASIBILITY_PREREGISTRATION.md",
    "williammolina489/crypto-funding-basis-bot@5bc714f718733613ef02af6cfb67e997167bf86e:PROJECT_STATE.md",
    "williammolina489/crypto-funding-basis-bot@5bc714f718733613ef02af6cfb67e997167bf86e:EXPERIMENTS.md",
    "williammolina489/crypto-funding-basis-bot@5bc714f718733613ef02af6cfb67e997167bf86e:ROADMAP.md",
    "https://github.com/williammolina489/crypto-funding-basis-bot/actions/runs/35782225218",
    "williammolina489/crypto-funding-basis-bot@216a8ad988b9221a5c2243046d2cdef7ee9d4be6:research/E002_RUN_AUTHORIZATION.json",
    "williammolina489/crypto-funding-basis-bot@84bbe0e1bb02b84f2066c9de93dd2e3847fd80a7:PROJECT_STATE.md",
    "williammolina489/crypto-funding-basis-bot@84bbe0e1bb02b84f2066c9de93dd2e3847fd80a7:EXPERIMENTS.md",
    "https://github.com/williammolina489/crypto-funding-basis-bot/actions/runs/35798071838",
    "https://github.com/williammolina489/passive-income-orchestrator/actions/runs/35902433867",
    "observations/e002_crypto_funding_basis_checkpoint_A.json",
    "williammolina489/crypto-funding-basis-bot@fbf80c39b6df741b9d8037fd28cbd96a7632b336:PROJECT_STATE.md",
    "williammolina489/crypto-funding-basis-bot@fbf80c39b6df741b9d8037fd28cbd96a7632b336:EXPERIMENTS.md",
    "williammolina489/crypto-funding-basis-bot@fbf80c39b6df741b9d8037fd28cbd96a7632b336:ROADMAP.md",
    "https://github.com/williammolina489/crypto-funding-basis-bot/actions/runs/36926478766"
  ],
  "last_result_task_id": null,
  "notes": "E002 collected no valid production evidence. Checkpoint A was launched after its frozen authorization window and the local authorization gate stopped execution before network access; the same-window retry expired and B/C did not run. E002 remains STOPPED / INCONCLUSIVE and requires a new explicit human experiment/preregistration decision for any future feasibility attempt. On 2026-10-01 the E002 branch status documents were synchronized to this already-recorded outcome at fbf80c39b6df741b9d8037fd28cbd96a7632b336; frozen preregistration and authorization files were not changed."
}
