{
  "schema_version": "1.0",
  "state_revision": 9,
  "project_id": "kalshi_market_maker",
  "repository": "williammolina489/kalshi-market-maker-research",
  "branch": "main",
  "head_sha": "53037cdfd0cfe3b85590304d031929c7304972d2",
  "lifecycle_status": "NEEDS_HUMAN",
  "experiment": {
    "id": "E001",
    "stage": "First 24h non-performance smoke completed; integrity review required",
    "status": "PREREGISTERED"
  },
  "governance": {
    "methodology_frozen": true,
    "performance_viewed": false,
    "validation_state": "NOT_APPLICABLE",
    "oos_state": "NOT_APPLICABLE",
    "data_integrity_status": "BLOCKED"
  },
  "current_blockers": [
    "Authorized run 36944108882 completed on 2026-10-03 and its immutable-replay job succeeded, but the final integrity-only artifact reports REVIEW_REQUIRED with 10,698 cadence-gap records. Smoke completion is not integrity PASS.",
    "PR #5 improved concurrent public GET polling and compressed-store safety on 2026-10-12, but that unvalidated future-capture improvement cannot change historical gaps or establish the frozen 99.5% coverage gate.",
    "The October 1 authorization was for one smoke only. A fresh integrity-only verification run needs a separate explicit owner decision; the official E001 30-day evidence window remains unstarted and not authorized."
  ],
  "next_permitted_actions": [
    "Review the existing first-smoke gaps by stream and timing without inspecting strategy economics or rewriting raw data.",
    "After explicit owner authorization of a new separately scoped non-performance verification smoke, preregister its dates, evidence isolation, fail-closed protocol, retention and acceptance checks before launching it.",
    "Keep the official E001 evidence window and economic analysis stopped until a verified infrastructure gate and separate explicit owner start decision."
  ],
  "forbidden_actions": [
    "Do not claim the rebuilt collector is the recovered prior implementation.",
    "Do not delete or rewrite the recovery branch, recovery manifests, dangling-object documentation, or failed recovery history.",
    "Do not modify the frozen E001 methodology or create E002.",
    "Do not calculate or expose E001 P/L or economic performance.",
    "Do not add order-placement, funded execution, or trading credentials.",
    "Do not spend money or use paid infrastructure.",
    "Do not start the official 30-day E001 evidence window.",
    "Do not reuse the original October 1 smoke authorization or treat a successful CI/workflow as a data-integrity PASS.",
    "Do not launch a second smoke without a new explicit owner authorization."
  ],
  "human_action_required": true,
  "human_action_reason": "First 24-hour smoke finished with REVIEW_REQUIRED and 10,698 cadence-gap records. After the code hardening, a new separate non-performance infrastructure verification requires project-owner authorization; E001's 30-day evidence window remains stopped.",
  "updated_at": "2026-10-12T08:56:00Z",
  "source_documents": [
    "williammolina489/kalshi-market-maker-research@recovery/e001-partial-stream-inspect:recovery/RECOVERY_MANIFEST.md",
    "williammolina489/kalshi-market-maker-research@main:PROJECT_STATE.md",
    "williammolina489/kalshi-market-maker-research@main:EXPERIMENTS.md",
    "williammolina489/kalshi-market-maker-research@main:ROADMAP.md",
    "williammolina489/kalshi-market-maker-research@7398fc455682d21980ea37ff8f542a5c0ce78f96",
    "Gmail search 2026-09-20: only GitHub failure notification for run 35479196728; no collector backup/archive attachment found",
    "Prior handoff: collector implementation was local and not yet committed/pushed",
    "User authorization 2026-09-22: clean rebuild from canonical E001 specification authorized after exact recovery exhausted",
    "williammolina489/kalshi-market-maker-research@main:research/E001_PREREGISTRATION.md",
    "Kalshi Stage 0 live unauthenticated contract revalidation: orchestrator Actions run 35790814838",
    "https://docs.kalshi.com/getting_started/quick_start_market_data",
    "https://docs.kalshi.com/getting_started/orderbook_responses",
    "https://github.com/williammolina489/passive-income-orchestrator/actions/runs/36913448293",
    "https://github.com/williammolina489/passive-income-orchestrator/pull/8",
    "williammolina489/passive-income-orchestrator@d01b36e4f5b47a832740b052e49ca7d759d7971b:jobs/kalshi-e001-clean-rebuild.json",
    "https://github.com/williammolina489/kalshi-market-maker-research/pull/1",
    "https://github.com/williammolina489/kalshi-market-maker-research/actions/runs/36935054968",
    "williammolina489/kalshi-market-maker-research@3a5cc4404d8eb199772ad156f38cf82fe7469f62",
    "williammolina489/kalshi-market-maker-research@04ef07ffb2106e6b96807de86727665185e72e15",
    "https://github.com/williammolina489/kalshi-market-maker-research/actions/runs/36942048042",
    "williammolina489/kalshi-market-maker-research@0daa353d40bf4a3cd69eb498f89300059f4f68ea",
    "https://github.com/williammolina489/kalshi-market-maker-research/pull/2",
    "williammolina489/kalshi-market-maker-research@6daccf95955c18a2efbb9b78f3d144c3779dedff",
    "https://github.com/williammolina489/kalshi-market-maker-research/actions/runs/36944108882",
    "williammolina489/kalshi-market-maker-research@5c469b0b1cce36f905b59eee0b705f4e5b34937f",
    "https://github.com/williammolina489/kalshi-market-maker-research/pull/5",
    "williammolina489/kalshi-market-maker-research@53037cdfd0cfe3b85590304d031929c7304972d2:PROJECT_STATE.md"
  ],
  "last_result_task_id": "kalshi-e001-24h-integrity-smoke",
  "notes": "The October 1 E001 non-performance smoke finished on October 3, not still running; performance-blinded review found 10,698 cadence-gap records. The read-only capture hot path was improved by Kalshi PR #5 on October 12 and CI passed. This is not a retroactive integrity PASS. The original smoke and E001 economic evidence remain untouched; new smoke and official E001 start both require explicit separate human decisions."
}
